{
  "$schema": "https://json-schema.org/draft/2020-12/schema",
  "$id": "https://automecanik.com/schema/fafa-media-factory/approval-record.schema.json",
  "title": "Approval Record",
  "description": "Artefact #5 (P0 video-governance) — historique approbation par stage. V1 utilise 3 flags discriminés (content_approved / render_approved / publish_approved) au lieu d'un seul can_publish ambigu.",
  "type": "object",
  "additionalProperties": false,
  "required": ["video_id", "approval", "gate_results", "history"],
  "properties": {
    "revision": { "type": "integer", "minimum": 0, "description": "Révision du dossier; toute correction prépare une révision supérieure et remet les approbations à false." },
    "video_id": {
      "type": "string",
      "pattern": "^[a-z0-9-]+$"
    },
    "approval": {
      "$ref": "#/$defs/ApprovalFlags"
    },
    "gate_results": {
      "type": "array",
      "items": {
        "$ref": "#/$defs/GateResult"
      },
      "minItems": 7,
      "maxItems": 7,
      "description": "Exactement 7 gates G1-G7 (P0 video-governance)."
    },
    "history": {
      "type": "array",
      "items": {
        "$ref": "#/$defs/HistoryEntry"
      },
      "minItems": 1,
      "description": "Trace audit chronologique des changements de status / flags."
    }
  },
  "$defs": {
    "ApprovalFlags": {
      "type": "object",
      "additionalProperties": false,
      "required": ["content_approved", "render_approved", "publish_approved"],
      "properties": {
        "render_sha256": { "type": ["string", "null"], "pattern": "^[a-f0-9]{64}$", "description": "Empreinte exacte du rendu approuvé; aucune approbation transférable à un autre rendu." },
        "content_approved": {
          "type": "boolean",
          "description": "Approbation humaine explicite du script, des claims, des preuves et du disclaimer sur leur version exacte. Le verdict du skill est une entrée de revue, jamais une approbation (règle AI2 du vault). Le schéma ne vérifie que la présence d'un nom, pas l'identité ni l'acte humain."
        },
        "content_approved_by": {
          "type": ["string", "null"]
        },
        "content_approved_at": {
          "type": ["string", "null"],
          "format": "date-time"
        },
        "render_approved": {
          "type": "boolean",
          "description": "Déclaration d'approbation humaine du MP4 exact après inspection visuelle/audio. Le schéma ne vérifie ni l'identité ni l'acte de revue."
        },
        "render_approved_by": {
          "type": ["string", "null"]
        },
        "render_approved_at": {
          "type": ["string", "null"],
          "format": "date-time"
        },
        "publish_approved": {
          "type": "boolean",
          "description": "Owner geste explicite séparé pour autoriser publication. STRICT V1: false par défaut, jamais auto-true."
        },
        "publish_approved_by": {
          "type": ["string", "null"]
        },
        "publish_approved_at": {
          "type": ["string", "null"],
          "format": "date-time"
        }
      },
      "allOf": [
        {
          "if": { "properties": { "content_approved": { "const": true } }, "required": ["content_approved"] },
          "then": {
            "required": ["content_approved_by", "content_approved_at"],
            "properties": {
              "content_approved_by": { "type": "string", "minLength": 1, "description": "Audit trail non-null obligatoire si flag=true. Bypass interdit." },
              "content_approved_at": { "type": "string", "format": "date-time" }
            }
          }
        },
        {
          "if": { "properties": { "render_approved": { "const": true } }, "required": ["render_approved"] },
          "then": {
            "required": ["render_approved_by", "render_approved_at", "render_sha256"],
            "properties": {
              "render_sha256": { "type": "string", "pattern": "^[a-f0-9]{64}$" },
              "render_approved_by": { "type": "string", "minLength": 1, "description": "Audit trail non-null obligatoire si flag=true. Bypass interdit." },
              "render_approved_at": { "type": "string", "format": "date-time" }
            }
          }
        },
        {
          "if": { "properties": { "publish_approved": { "const": true } }, "required": ["publish_approved"] },
          "then": {
            "required": ["publish_approved_by", "publish_approved_at"],
            "properties": {
              "publish_approved_by": { "type": "string", "minLength": 1, "description": "Audit trail non-null obligatoire si flag=true. Bypass interdit (STRICT V1 owner-only)." },
              "publish_approved_at": { "type": "string", "format": "date-time" }
            }
          }
        }
      ]
    },
    "GateResult": {
      "type": "object",
      "additionalProperties": false,
      "required": ["gate", "verdict", "measured"],
      "allOf": [{
        "if": { "properties": { "measured": { "type": "null" } }, "required": ["measured"] },
        "then": { "properties": {
          "gate": { "enum": ["G3", "G4", "G5", "G6"] },
          "verdict": { "const": "FAIL" }
        } }
      }],
      "properties": {
        "gate": {
          "type": "string",
          "enum": ["G1", "G2", "G3", "G4", "G5", "G6", "G7"]
        },
        "verdict": {
          "type": "string",
          "enum": ["PASS", "WARN", "FAIL"]
        },
        "measured": {
          "type": ["number", "null"],
          "description": "Valeur observée ; null uniquement pour G3-G6 en FAIL quand l'observation est absente. Jamais un zéro inventé ni un verdict de succès."
        },
        "warn_threshold": {
          "type": ["number", "null"]
        },
        "fail_threshold": {
          "type": ["number", "null"]
        },
        "strict": {
          "type": "boolean",
          "description": "G2 Safety et G6 Visual Honesty = STRICT (1 violation = FAIL)."
        },
        "details": {
          "type": ["string", "null"],
          "maxLength": 1000
        },
        "trigger_items": {
          "type": "array",
          "items": {
            "type": "string"
          },
          "description": "Liste des éléments (claim_id, asset_id) ayant déclenché le verdict."
        }
      }
    },
    "HistoryEntry": {
      "type": "object",
      "additionalProperties": false,
      "required": ["timestamp", "actor", "action"],
      "properties": {
        "timestamp": {
          "type": "string",
          "format": "date-time"
        },
        "actor": {
          "type": "string",
          "description": "Identifiant déclaré de l'acteur historique (humain ou skill selon l'action). Une entrée d'historique, même nommée content_approved ou render_approved, n'authentifie pas une approbation humaine."
        },
        "action": {
          "type": "string",
          "enum": [
            "brief_created",
            "script_drafted",
            "claims_evidenced",
            "gates_evaluated",
            "content_approved",
            "content_rejected",
            "render_triggered",
            "render_approved",
            "render_rejected",
            "publish_approved",
            "publish_rejected",
            "published",
            "measured"
          ]
        },
        "comment": {
          "type": ["string", "null"],
          "maxLength": 500
        }
      }
    }
  }
}
